,comment,info
0,"別にアスリートが社会問題に抗議の意思を示すことは悪いことではないし、むしろ良いことである場合も多い。マスクTシャツ多いに結構。でも、その方法が本業である試合のボイコットという話になると、特にテニスのような個人の対戦競技だと、自分の主張のために対戦相手のキャリアに大きな影響を与えることになるから、慎重に考えるべきだと思う
。",url: https://news.yahoo.co.jp/articles/88ff2b096396e57d20b3a8a7a319d72c71a3a73f/comments?page=19&t=t&order=recommended
1,"色々な意見があって良いと思う
個人的にはコートに持ち込まなければいいんじゃない、と思うよ
ただ、なんでもかんでも思ったことを口走るのではなく、自分の影響力を考えた上で行動してほしいなとは思う",comment num: 197
2,"「アスリートは政治的に関わるな、ただ楽しませればよいという意見が大嫌い。」
この意見はごもっともだと思うが、スポーツの場に政治的な表現を持ち出すのは違うと思う
政治的な活動はテニスとは切り分けて行って欲しい",
3,残念に思うのは日本人対決にもかかわらず大坂なおみさんをあたかも正義の味方のように取り上げるメディアの姿勢だ、土居さん立場にも立って欲しい。スポーツとは分けて報道するべき、人権問題は大切だがせめて日本人対決ならば平等に扱って欲しい。,
4,「アスリートは政治的に関わるな、ただ楽しませればよいという意見が大嫌い。」っていう意味の捉え方がおかしい。だからと言ってコート上に持ち込むのはサッカーで韓国が竹島アピールしたのと同じ。対象がなんであれ政治をスポーツの中に持ち込むのはダメだと思う。,
5,"人種差別への抗議行動は間違ってない。

でも自身の社会への影響力を意識しているのならば、単なる主張だけでなく、BLM運動がきちんと理解され他人種にも広く受け入れられるような正しい方向へ進むようにして行くことが必要なのでは？

今の状況は文革における愛国無罪と同様の「BLM無罪」で、権利を主張するばかりでかえって反感を招き、分断と憎悪を生むだけではないかな。結局自分たちさえ良けりゃいいのか、と。

彼らの中からそういう主張が殆ど聞かれないのが不可解",
6,"別にアスリートが政治に絡んでも良いと思う。
ただ、それはコートの外での話。
前の大会みたいにボイコットしたり、日程変更されたら翻したりは違うと思う。

試合に関係ない所で発言したりするのは自由だし、ルールで許容されている中で抗議の姿勢を示すのは良い。例えばユニフォームとか。

今の人種差別を理由にすれば何をしても良いという風潮は好きではない。",
7,"政治云々というより...
準々決勝勝利→準決勝は抗議の為棄権します→準決勝は不戦敗
となるでしょ...
いくら準々決勝の相手が自分よりランクが低かろうが、負けた相手の心情を考えると、誉められた行為じゃないでしょ。",
8,"アスリートだっ目政治的な発言は多いにしてもらっていい。人間なのだから。だけど、発言なら構わないが、大会や、参加している団体を巻き込んでまで活動するのはだめでしょ。
あなたは、抗議のつもりかもしれないけど他の選手にとってみたら、今まで練習してきて明日大一番というときにあなたたちのような行動が他のアスリートのモチベーションだったりに影響するんだよ。
そういうのをスポーツ会に持ち込んだらだめでしょ。フェアでなくなるよ。あなたは抗議してスッキリかもしれないけど、試合を延ばされた方はたまったもんじゃないよ。
抗議の仕方は間違ってると思う。",
9,抗議はいいと思う。が、試合会場でそんなマスクする必要がないのでは？対戦相手もいて迷惑かける可能性あるし、大会スポンサーもいる、全世界に放映される。他人への影響や迷惑も考えるべき。本当に抗議したいなら、試合会場以外でも、プライベートでもあのマスクつけるべき。,
10,"別にアスリートが社会問題に抗議の意思を示すことは悪いことではないし、むしろ良いことである場合も多い。マスクTシャツ多いに結構。でも、その方法が本業である試合のボイコットという話になると、特にテニスのような個人の対戦競技だと、自分の主張のために対戦相手のキャリアに大きな影響を与えることになるから、慎重に考えるべきだと思う
。",
11,"色々な意見があって良いと思う
個人的にはコートに持ち込まなければいいんじゃない、と思うよ
ただ、なんでもかんでも思ったことを口走るのではなく、自分の影響力を考えた上で行動してほしいなとは思う",
12,"「アスリートは政治的に関わるな、ただ楽しませればよいという意見が大嫌い。」
この意見はごもっともだと思うが、スポーツの場に政治的な表現を持ち出すのは違うと思う
政治的な活動はテニスとは切り分けて行って欲しい",
13,残念に思うのは日本人対決にもかかわらず大坂なおみさんをあたかも正義の味方のように取り上げるメディアの姿勢だ、土居さん立場にも立って欲しい。スポーツとは分けて報道するべき、人権問題は大切だがせめて日本人対決ならば平等に扱って欲しい。,
14,「アスリートは政治的に関わるな、ただ楽しませればよいという意見が大嫌い。」っていう意味の捉え方がおかしい。だからと言ってコート上に持ち込むのはサッカーで韓国が竹島アピールしたのと同じ。対象がなんであれ政治をスポーツの中に持ち込むのはダメだと思う。,
15,"人種差別への抗議行動は間違ってない。

でも自身の社会への影響力を意識しているのならば、単なる主張だけでなく、BLM運動がきちんと理解され他人種にも広く受け入れられるような正しい方向へ進むようにして行くことが必要なのでは？

今の状況は文革における愛国無罪と同様の「BLM無罪」で、権利を主張するばかりでかえって反感を招き、分断と憎悪を生むだけではないかな。結局自分たちさえ良けりゃいいのか、と。

彼らの中からそういう主張が殆ど聞かれないのが不可解",
16,"別にアスリートが政治に絡んでも良いと思う。
ただ、それはコートの外での話。
前の大会みたいにボイコットしたり、日程変更されたら翻したりは違うと思う。

試合に関係ない所で発言したりするのは自由だし、ルールで許容されている中で抗議の姿勢を示すのは良い。例えばユニフォームとか。

今の人種差別を理由にすれば何をしても良いという風潮は好きではない。",
17,"政治云々というより...
準々決勝勝利→準決勝は抗議の為棄権します→準決勝は不戦敗
となるでしょ...
いくら準々決勝の相手が自分よりランクが低かろうが、負けた相手の心情を考えると、誉められた行為じゃないでしょ。",
18,"アスリートだっ目政治的な発言は多いにしてもらっていい。人間なのだから。だけど、発言なら構わないが、大会や、参加している団体を巻き込んでまで活動するのはだめでしょ。
あなたは、抗議のつもりかもしれないけど他の選手にとってみたら、今まで練習してきて明日大一番というときにあなたたちのような行動が他のアスリートのモチベーションだったりに影響するんだよ。
そういうのをスポーツ会に持ち込んだらだめでしょ。フェアでなくなるよ。あなたは抗議してスッキリかもしれないけど、試合を延ばされた方はたまったもんじゃないよ。
抗議の仕方は間違ってると思う。",
19,抗議はいいと思う。が、試合会場でそんなマスクする必要がないのでは？対戦相手もいて迷惑かける可能性あるし、大会スポンサーもいる、全世界に放映される。他人への影響や迷惑も考えるべき。本当に抗議したいなら、試合会場以外でも、プライベートでもあのマスクつけるべき。,
20,この国は差別問題ばかりが騒がれるが、毎年76万の子供が行方不明になってる件の方がはるかに深刻だと思うんだけどほとんど報道されないね…。,
21,「BLACK LIVES MATTER」の翻訳は（黒人の命は大切だ）であるべき。（黒人の命【も】大切だ）と訳してしまうとそのニュアンスは全く別なものになってしまう。「BLACK LIVES MATTER」という文章のどこに【も】の意味合いが含まれるのか。,
22,"これまでの数々の浅薄な言動をしてきた大坂選手が、こういうことをしてもなあと称賛より軽蔑に近い感情を持ってしまった。

黒人差別に対する反対パフォーマンスは、その行動そのものより、むしろ誰がそれをやったかが注目される。

これまでの大坂選手の人となり、というやつがネガティブで、そういう人物がこういった類いのパフォーマンスやっても、なんだかなあって違和感しかないし、それと同時に嫌悪感を持ってしまうよ。",
23,"民主党がBLMを利用して、反トランプの象徴にしている以上、BLMは完全に政治問題になっている。

したがって「スポーツに政治を持ち込むべきではない」という主張は正しいと思う。悪いのは利用した民主党だけどね。",
24,"Black Lives Matterでなく、Human Lives Matterではないか、その方が世界中の人に受け入れられると思う。人類の歴史は、ある意味で差別と迫害の歴史であり、ほとんど世界のすべての国々が何らかの形で経験し、今まだ経験しているのではないだろうか。黒人だけの問題ではなく、すべての人間としての在り方を問う運動になって欲しい。黒人が他の人種を差別・迫害する局面が全くないと言えるかな？奴隷制度という厳然たる負の歴史的事実があるが、現在において黒人だけを""特別扱い""にするのは、また、別の差別・迫害を生むのでは？ただ、アメリカの文化と国風が、子どもの頃抱いた""イメージ”とは、少しづつ違うものになりつつある。",
25,"主義主張は分かるけど、それを発信するのはコートの上じゃないと思う。
仕事と無関係な個人的な思想を仕事中に仕事場に持ち込めば会社や同僚はどう思うかな？って考えられない程、大坂なおみは精神的に未熟なのかもしれない。
逆に敢えて自分の立場を利用しているのであれば、責任を伴う立場にいる事を彼女自身もっと理解すべきだと思う。
これは日本人的な考え方かもしれないけど・・・。",
26,"本当にがっかりですね。
スポーツと政治を分けるってのは今まで皆で守ってきたのに。
こういう行為が許されると、実はアスリート自身が大変になる。
政治に触れない選手は「なぜ声を上げないのだ？」と叩かれることになるだろう。そして政治的な主張というのはどんな選択をしても必ず敵を作ることになる。",
27,"アメリカはスポーツ選手の社会的地位が日本とは全く違う。
あと、彼女の場合はラッパーの交際相手の影響、大きいと思う。もともと意識高かったが、さらに色んな思想めいたことを吹き込まれているだろう。",
28,"この行動を称賛するのは個人の自由だから、どうこう言う気は無いが・・・。

>「オオサカの勇気と信念とともに立ち上がるテニスプレーヤーがもっと必要だ」

この反応は違うだろって思う。
こういう他者に強要する姿勢がBLM運動がダメだと思う理由だ。",
29,試合をボイコットされた相手選手の事も考えて欲しい。この試合にメンタルや体調を整えてきたんだし、お金の問題もある。人権と騒ぐなら身近な人達の人権も考えてあげて欲しい。,
30,"〉「BLACK LIVES MATTER（黒人の命も大切だ）」

これは意図的誤訳だと思うけど、BLMは「黒人の命が大切だ」だよね。
ALL LIVES MATTER だと思うけどね。

〉名前はブレオナ・テイラーさん。3月にケンタッキー州の自宅で寝ていたところ、麻薬捜査の一環で踏み込んで来た警官に射殺されたという黒人女性だ。

もう少し説明しないといけない。麻薬の受け取り先がテイラーさんの住所と認識されていて、無断で踏み込める令状を警察は得ていた。それで侵入したところ、不審に思ったテイラーさんの彼氏が発砲し警官を負傷させた。警察は家の中に20発以上撃ち込み、8発がテイラーさんに命中し死に至らしめた。

警察に落ち度があるかどうかは微妙なところで、ましてや黒人差別が原因だったかどうかはわからない。",
31,"韓国人サッカー選手が、
「独島はわれらの地」というプラカードを掲げて問題になっていたけど、
スポーツ選手が政治活動して良いのなら韓国の例もOKになるだろうし、
反日運動もOKになりかねない。
個人的には政治的活動を試合に持ち込むのは良くないと思う。",
32,"個人的には賛成なんやけど、 これ ドツボに
はまるよ。

政治的意見は大事やし 、尊重したい。

でも 大坂なおみは活動家ではない。

プロテニスプレーヤーである。

政治的な対立のハリケーンに巻き込まれつつも、しのぎを削るプロテニスの世界で黙々と練習をして
活躍し続けれるか。 。

茨の道には違いない",
33,テニス協会にも権利があり、棄権するとか１日大会休むとなると他の人に迷惑がかかる。自分の事ばかり考えて抗議すると差別する人と同類になる。,
34,"何かモヤモヤした意見になっちゃうけど
サッカーなんかだとこういう事は禁止になっていて
確かイエローカードが出ると思ったけど、東日本大震災の時の
ウッチ―のメッセージみたいなのはOKだよね。
試合会場に入ったら禁止にすればいいのかな。。。
「竹島は○○の領土」なんてのもあったし、
基本的に他国に対しては駄目だよね。
自分の国に対して試合会場以外で抗議する分にはいいのかなと。",
35,"？？？
「アスリートは政治的に関わるな、ただ楽しませればよいという意見が大嫌い。」？
言われたのは
「スポーツに政治を持ち込むな」
だろ。
五輪憲章でも禁止されている事で、スポーツの政治的中立性を保つ為、スポーツの場を政治的な宣伝の場にしない為に必要な措置だ。
馬鹿じゃないの？",
36,"人権について発言する事はありだと思いますが、
あまり何回もその事だけを発言するのはウンザリします。
スポーツ選手はやはり身体で体現してくれるほうが発信力の重みが
でると思います。",
37,"スポーツ選手が政治問題に口を出すな、というつもりはない。人にはそれぞれ自分の考えを表明する権利はあるから。
ただ、スポーツ選手はスポーツが本業。その本業をおろそかにしてまで政治的な活動は行わないでほしいと願います。それだけ。",
38,"スポーツ選手はボイコットとか棄権とかではなく、優勝する事で黒人だって変わらないんだという見せ方の方が気持ちいい。
大坂選手だけじゃなくてね。

会社で働いている一般人とは違うんです。その立場にある人間が見せるべき行動というものがあります。
フェアプレイが尊ばれるのは理由があります。トッププレーヤーがラケットやバットを折ったり、暴言を吐いたりする行為は多くの人へ影響を与えます。
そういう意味でも、一般人とは違う立場である認識を忘れないでもらいたい。
イチローが素晴らしいと言われるのは、その立ち振る舞いがあるから。
デイビッド・ベッカムも、ワールドカップで愚行を行いものすごいバッシングを浴びました。その後、改心してからの立ち振る舞いは評価を180度変えました。
でもタトゥーは英国内でも賛否両論です（笑）",
39,SNSなどでは主張は自由に力強くしてもいいと思います。しかし、プレーにそれを持ち込んだら、悲しむ人、戸惑う人、傷つく人も居るのではないでしょうか？例えば、反対の意見の方と対戦した時に、その対戦は本人たちの意思の如何によらず、政治主張同士と無関係と言えなくなってしまうのではないでしょうか？そういった悲しい結果にもつながってしまうことだということをアスリートの方々にはよく考えて行動していただきたいです。,
40,抗議行為自体は理解できるが、本人のイメージのために、あまりやりすぎない方がよいのでは。,
41,どこかの国のように、試合相手に政治的な問題を持ち込んだり、抗議（という名の侮辱）したりするのは勘弁してほしいけど、そうでない限りはいいのでは？と思います。,
42,政治的な意見を言いたければ他の場所でやるべき。影響力を使って一方的な意見を言うのは間違っている。主張すべきところは相手の意見のも聞いて反論できる場所で。,
43,テニスと関係ないところでやればいいと思う。大会前後でコメントやメッセージを出す方が的確につたわるのでは。有名人なのでそういう場をつくれる人だと思うけど。,
44,"ルールに抵触しないならＯＫ。
こうやって話題になっているだけで成功だと思う。

賛否両方あるなんて、本人は最初から分かってるでしょう。
応援したい人はすればいいし、したくない人はしなければいい。
理解して欲しいな、ぐらいの気持ちはもちろんあるだろうけど。
無関心が最も嫌だろうね。",
45,そもそも人種差別に反対することがなぜ政治的なのか、基本的人権の問題は政治には関係ない。彼女がそれを主張するのは当然の権利である。,
46,"これ何も指導やペナルティ無いって事は、今後はこういった活動や訴えを試合に持ち込んでもＯＫって事ですよね？ｗ
チベット、ウイグルの主張や、台湾とかもどんどん主張していいんですねー",
47,スポーツに政治は持ち込んではいけない。ましてや人種差別なんてもってのほか。抗議するのはいいが、抗議の仕方というのがある。抗議してるのにこういう大会でプレーしてるのはどうなの？身の危険を訴えてるのに普通にプレーしているというのはなんか違う。,
48,"米国に住んでいて、思考言語も英語なんだから、どこから見ても米国席が相応しかった。
日本企業のCM と　オリンピック枠狙いで日本国籍にしただけだ。
わきまえて大人しくしていればいいいのに、馬脚を表したな",
49,"ちょっとこの人、なんだかどんどん面倒くさい人になっていってるねぇ…(苦笑)
若いからネットに飲み込まれちゃってるって感じ。

てかね、日本のメディアは正に日本らしく何も分かってないみたいだけど、
> 「BLACK LIVES MATTER（黒人の命も大切だ）」

間違いだから(笑)
黒人の命、は！！！！！、大切、なんですよ。アメリカの現地でのニュアンスは。も、なんていうとマジで袋叩きですからね、お気をつけを。",
50,スポーツに政治は持ち込まないでほしい。全てのスポーツ選手がいちいち試合の度に各々の自分の政治的主張を始めたらうんざりだよ。そういう場所じゃないでしょ。,
51,"「いじめられる側にも問題がある」が完全に真だとは思わないが、一部許容せざるを得ない場合もある。
差別される側に問題がある、についても、そうなっていいのだろうかね？",
52,皆さんもっと世界の人権問題について勉強するべきだと思います！知らないから彼女の気持ちがわからないだけ、の意見がたくさんみられるのは、ただただ残念。,
53,抗議の内容や賛否はいったん置いておくとして、大坂さんこのところテニスに集中できていないね。いちファンとしてはそこが心配で残念。,
54,自分と同じ価値観や考え方でない人をいっさい認めず、批判ばかり、嫌悪感ばかりというのはいかがなものかと思います。,
55,"勝手にコートに持ち込むなという意見があるが
会場の客席自体に大きく「BLACK LIVES MATTER」が掲げられています。
全米テニス協会も取り組んでいる意思。",
56,"撃たれた側にも問題あるでしょ。

警官の静止を無視したわけだし

日本にいるからわからないんだよ。アメリカに一度でも住んでみればわかるよ。

銃社会の怖さは・・・",
57,単純にテニスの試合と考えると、相手の選手に失礼過ぎる。土居選手に勝って欲しかった。,
58,戦うんだったら暴動に参加してはいかがでしょうか？テニスを通じてアピールするのは利用してるとしか思えん！,
59,なんかこの問題はモヤモヤさせられる。警官が悪いだけみたいに言われるがすべての事件の背景をしっかりと報道してほしい。,
60,"以下の発言、結構好き。
頑張って欲しい。

アスリートは政治に関わるべきでない、人々を楽しませていればよいと誰かが言うのを私は聞きたくない。
第1に、これは人権の問題だ。
第2に、私よりもあなたの方が発言する権利があるという理由は？
その論理でいくと、もしイケアで働いていたら、（イケアで販売するソファの）『GRÖNLID』（グローンリード）のことしか語ってはいけないの？」。7月初め、彼女は米誌「エスクァイヤ」に、人種差別への抗議運動「ブラック・ライブズ・マター（黒人の命は大切）」を支持するエッセイを発表。その中で警察予算の削減を支持する考えも示した。",
61,"別にアスリートや芸能人が政治的発言をしてもいいと思う。
特に大坂さんは一貫して人種差別問題に対してだし、「ボイコットはやりすぎでは」と思わないでもないけど抗議は違和感が無い。
敢えて言うなら、今回のアメリカの白人警官による黒人射殺事件は「銃社会問題」なんじゃないかな、と個人的には思うけど。


でも、中には「半ばファッションでやっているでしょ？」と思う発言もある。
最近で一番納得いかない芸能人の政治的発言は、先日日本で起きた「#◯◯に反対します」。
詳細分かって反対した人は一体何人いるんだろう(汗)
あと、サッカー界の「人種差別問題」。
人種差別反対とか言っておきながら、けっこう差別的なことやらかしているように見える。
こうなると違和感満載で、「は？」と思ってしまう。",
62,"大坂「この大会、私は７種類のマスクを用意している」

毎試合やる気なのか？
さすがにスポーツの場でやり過ぎに感じる",
63,あくまで個人の意見ですがスポーツに「政治や思想」を持ち込む人は応援する気になれないです。,
64,"アスリートだろうが、しかるべき場で活動するならいいんだろうけど、大会とかを利用するのは迷惑。

誤審とかが起きても人権問題と絡めてきそうで、集中できなくなる。",
65,"抗議するのは自由
でもスポーツの試合の時にするのは違うし、興醒めです
全く見る気が無くなる",
66,厄介な倶論棒、傲慢な倶論棒になりましたね。奢りですか?もう応援しません。,
