,comment,info
67,米国ではインディアンが殺戮されてきた事とかこの方知ってるのかな？,
68,日本代表だし、日本人とのハーフだし、ちょっとのっかりすぎ。恋人に感化されてる。大金をくれてるスポンサーが喜んでるとでも思ってるの？,
69,"肥し違いな話であって競技する場所に
持ち込むべきではない。
だったらプライベートの時に抗議運動などに
参加するのが筋じゃないかな？",
70,"最近はワガママで自己中な印象しか無い。
最近は正直言って対戦相手に勝って欲しいと思ってきた。",
71,"棄権、やっぱり出場、又々怪我で棄権！
と思ったら、直ぐ別の大会に出場？
何これ？
直ぐに、ふて腐るし、応援はもう辞めた！",
72,"3月の事件を蒸し返すのは
何か特別な意図があるのでしょうか？",
73,"この問題は、我々にはわからないくらい根っこの深いものなんだろうな。
それを理解しないうちは、大坂なおみのこの行動についていい悪いを言うのは失礼かもしれない。",
74,"この大坂選手のアクションに「ボイコットはやり過ぎ。」はお門違い。自分達、黄色人種の問題でもある。あくまでマイノリティーなのよ日本人は。欧米では未だのけ者扱いされる場合もある。
主催者とNIKEは進んでいて、沈黙するアスリートにはスポンサーとしてついてくれない。",
75,"そんなことしながらプレーに集中できるん？
できるんならいいけど。まずテニスをちゃんとやってね",
76,"この問題を除いても
めんどくさい
感じが最近はしますね",
77,"抗議はいいと思うが…という意見は
認めたフリして認めてない
寛容なフリをして全く寛容でも理解があるわけでもない",
78,勝つことで発言するのは全く悪いことじゃない。がんばれ！,
79,土居さんに勝って欲しかったって言っても何か言われそう,
80,正直、ラッパーの影響でしょう。,
81,"なんでテニスコートで！
相手の選手も巻き込まれて、いい迷惑でしょうに。
どーしてもやりたいなら、別の場所、別の方法で、
しかも、棄権とか、マスクとかじゃなく、言葉で、きちんと、やりなよ。
って思う。",
82,人種差別問題って政治なの？そう考えてる人は、規制されないとこの問題を受け止めて行動出来ないんだろうな。モラルの問題なのにね。,
83,そんな難しい話ではなくてただ単に、この人が嫌われてるだけです,
84,"俺的にはアウト。
プライベートで活動するのは個人の自由。
しかし、試合会場には持ち込むな。",
85,"スポーツに政治を持ち込むな？
何を言っている。
オリンピックなんざ、政治利用そのものだろうが。
訳の分からない解釈をするんじゃない。
大坂選手を全面的に支持する。",
86,SNSやインタビューでは好きにすればいいが、試合でやるんじゃねえよ。,
87,"あほくさ……
人種差別が政治問題か？",
88,もうやりたい放題だな。批判は全て差別で封殺出来るからな。それこそ差別では。,
89,"US Openって日本で開催されてるんでしたっけ？だったら日本人感覚(コートの外でやってくれとか)で批判しても良いですがね〜。
NBAやMLBなんかは普通にコート・球場内で選手が抗議を行ってるのがアメリカです。
対戦相手や主催者・スポンサーが迷惑？それって本当？単なる浅はかな日本人としての推測でしかないよ",
90,自分の影響力を自覚するした上で為される行動はやはりどこかで不純な感じがします。,
91,"試合を棄権するのは、スポンサー契約、大会運営に対する損害、チケットを買って楽しみにしているファンへの裏切り…

プロとしての責任も自覚も足りない非常な不遜な行いだった。

個人としたならば、同じ人種の境遇への心情は察する。義務と責任に反しない限り非難をすべきところではない。

なお、混同してヘイトに利用するマスコミに騙されてはいけない。",
92,競技に持ち込むべきではない。競技外なら勝手にどうぞ、である。,
93,"スポーツに政治を持ち込むな

常識無さすぎ",
94,"重要なのかもしれんけど試合にまでいちいち持ち込むなって
対戦相手にも失礼やろ",
95,あまり度が過ぎるとグレタさんみたいにそのうち世界中から失笑されてしまうよ。ほどほどにしないと。。,
96,"オフコートでやれと言う声もあるけど、彼女の表現の場はコート上と言うことだろう。
私は尊重する。",
97,"テニスコートに政治を持ち込まないで欲しい
どうも好きになれないな",
98,何を発信するかなんて、本人の自由であり、他人が制限するものではない。,
99,"彼女は政治的なことなど主張してない。
「人権」を訴えただけ
「差別」に抗議しただけ
正しいことを言っただけ",
100,次負けてマスクも終わり,
101,日本人の感覚とは違うな。,
102,人種差別批判もいいけど銃社会アメリカも批判してください。,
103,"黒人への差別があることは事実。

でも、
黒人の犯罪者に、罪のない警察官や他人種の人が急に撃たれて命を落としているのも事実だし、
暴徒と化して略奪している黒人が多いのも事実。

なのに、黒人だけが命を落としていると
デモしているのに違和感を感じるし、
それをそのままプロスポーツに持ちこむことは私的には好きではない。",
104,"日本人が、年間に何十人も、普通に、あたりまえのように、殺されていて、相手はたいした罪にならなかったら・・・、自分も殺されるかもしれないって言う、身の危険を感じて、怖いし、やめてくれ！ってあなただって思うでしょ！
日本人に置き換えて考えてみてください。
「日本人を殺さないで！！」って叫んで抗議すると思います。

大阪はボイコットして抗議するより、大会に出て、メディアに抗議のマスクやシャツを映したほうが効果があると思ったのかも知れませんね。",
105,"彼女はアメリカでも、日本でも差別的な扱いを受けた経験があるからの行動ですよね。
理不尽な人生を送ってきていたからの発言だと思います。

白人警察官の黒人に対する行動が行き過ぎているのも事実。
先ほど雪が降る中で死亡した黒人の映像を見ましたが、本当に酷い映像でした。


賛否両論。それは構いませんが、なぜ彼女が訴えているのか背景を知るべきです。",
106,"何が気持ち悪いって、NHKニュースでこのアピールを持ち上げて、過去のオリンピックで黒人選手が表彰台で人種問題をアピールしたら順位を取り消されたことを問題視した事と、これからのオリンピックは人種問題を伝えることが大切ではないでしょうか？と締めくくった点。一方的にやられている人種も見方を変えれば加害者では？
スポーツで政治及び人種問題等をアピールする選手にはなんらかのペナルティをと考える自分はおかしいのだろうか？",
107,黒人の命も大事、いや、白人、黄色人ほか人間そのものが大事、黒人が特化し今更ながら、なぜアメリカで問題になっているのかなあ・・多分黒人の占める人数が多いアメリカならではのこと。良からぬ人間がたまたま黒人であったとして、白人に限らなず、黒人とか、アジア系であっても、アメリカの警察官の殉職率は、日本では考えられないほどだ。だから「自分の命も大事」と、警察官も過剰に反応するのも、少しわかる。,
108,"人種差別が政治的な問題であろうか？
私はそうでは決して無いと思う。
我々島国日本人には根本的に理解出来ない長く深い闇が延々と続いてきている人類全体の問題だと思う。
白人至上主義者達の傲慢さは何なんでしょうか？
我々アジアの黄色人種もいざとなれば、差別的な偏見が欧米人達から出て来る。
新型コロナ問題の時もそう、日本人を見れば国へ帰れコールがあったと聞く。",
109,"大阪さんの母親は日本人だけどアジア系の人が新型コロナで差別を
受けて時に抗議のメッセージを出したのかな？",
110,大坂さんはもう少し今回の事件について事実関係を調べた上で自分の態度を決めた方が良い。映像や報道を見る限りどう見ても殺された黒人男性側に非があるように思える。警察官の制止を振り切って車の中から何かを取り出そうとしている。仮にそれが刃物や銃だったとしたらその場に居た警察官だけじゃなくその男の暴力行為を警察に通報した人も殺されるかもしれない。大坂さんが擁護する価値があるとは思えない。,
111,"影響力があるからこそ同じ黒人として社会問題となっている命の重さを抗議してるんだろ
警官に殺される日常がない日本人には分からないことだろうが
影響力がある前提として波紋を投げかけたいのだろう。
何せ口だけ大統領が発砲した者を擁護するようじゃね

試合棄権も大阪だけじゃない。
行動での抗議
当然、相手や相手チームにだって事前に伝えているはず。
ただフケるのとは違うだろ。

アスリートだからとかの前に1人の人間としてただ生きる権利を主張している。
SNSで無責任に自分勝手な憶測で他人を陥れてるやつらの方が物事考えてない。
影響力なんて今どきそこらの一般人たちが徒党組んで陥れてる。

今、出来ることをしてる
何もしない日本人よりはちゃんと意志を持ってると言える。
ま、有名人だからアンチもいるんだろうがな
そうゆうのはただ文句言いたいだけだろうし
眼中にないだろうなw",
112,"一応日本人だろ？
日本人の総意と思われかねない。
軽はずみだよね。
国代表して出ているんだろ？
なんだか凄い違和感。
しかも出場辞退からまた出場。
やっていることに信念も思いも感じない。",
113,"今回は例えば白人であっても警察は撃っただろう。制止を無視し、車内に入り手を伸ばした。
大坂なおみは、黒人ならどんな場合でも撃つなと言ってるのと同じ。
自分達さえ良ければ良いという最悪な行動です。",
114,"素晴らしい黒人もいるし、
どうしようもない黒人もいる。
素晴らしい白人いるし、
どうしようもない白人もいる。

それだけ。",
115,黒人ではなく、日本人が虫けらのようぬ殺されてたら、何らかの方法で自分だって主張するだろう。大坂選手もそれと同じことをやったまで。やっても良いと思う。それでも棄権は違う気がする。棄権と言ってたわけじゃないみたいだけど。,
116,日本代表ではあるけど、やはり日本人の考え方ではない。アメリカ人の友人からしたら、大坂なおみが日本人ということにすごい違和感を感じるみたい。,
117,正直失望。スポーツ選手として、小さい子供たちに夢や希望を与える存在であって欲しいけど、特定の思想に支配された人間は好きじゃない。神聖なコートの上じゃなくて、プライベートでストリート行進に参加すれば？,
118,"スポーツに政治や主義主張を持ち込む事に対し
ずっも嫌悪感を抱いてきたが、その理由が判った。

対戦相手、すごいやり辛いよねこれ。
大会側も神経使わないと、もし黒人相手に
誤審でもしたら必要以上に非難されるから
腫れ物に触るような扱いになる

フェアプレイを求められるスポーツの舞台で
マイノリティの盾を振り回して戦う行為、
彼らが敵視する白人が白人特権を振りかざして
事を有利に運んでいるという主張と何が違う？
よくもまあ相手を非難できるものです。",
119,"民主党寄りの全米テニス協会がテニスを大統領選に利用するため、本来は禁じられている選手の政治アピールを大会直前に認めたことがそもそもの元凶。

BLMは人種差別を隠れ蓑にした反トランプ運動であり、ANTIFAという暴徒を民主党の大スポンサーであるジョージ・ソロスが指揮しているのは有名な話。

大坂なおみの行動はテニスを利用して偏った政治的メッセージを拡散し、暴徒を正当化する恥ずべき行為でありテニスへの冒涜である。",
120,Twitterで流れてくるネトウヨのコメントを読む度に、ああネトウヨとはこういう人たちなんだよなと改めて実感。おそらく大坂選手本人にも執拗に中傷してるはずだから、いい加減、日本人に呆れて近いうちに国籍をアメリカに変えるんじゃないかと思う,
121,BLMに同調しない座っている白人女性を集団で取り囲み叫んで攻撃している動画を見たので嫌悪感を感じてます。TPOわきまえてやる分には異論は無いがスポーツに持ち込まないでほしい。,
122,"貴女の本業は何ですか？
貴女の国籍は何処ですか？

楽しませた上での発言なら、日本人は納得しますが、
主張だけ先走るのは、日本では通用しない
米国ではそうなのかね？

都合良いところだけ使うのは、ずるいんじゃね？
日本人ということで、日本企業のスポンサー
文化は米国ってな

「アスリートは政治的に関わるな、ただ楽しませればよいという意見が大嫌い。」",
123,"放火、略奪、不法侵入、暴力による脅威
これらを受けた（人種に関係なく）人達に向けたメッセージを出しているのは誰か？
大坂なおみではない。",
124,"主張は良いですが、試合の外でやってほしい

白人が対戦相手だったらどうするのか

ここで白人が買ってしまったら完全に悪者です
ネットでも叩かれまくります

こんな状況で集中して試合できるのか
同じアスリートなら適切に判断してもらいたいです",
125,"今のままでは白人が黒人に酷い殺され方をしても世論は｢白人が悪い｣なんだろな。
この子は一体何を見て、聞いて、考えているのだろうか？最近のメディアに出て影響力のあるタレント、スポーツ選手、馬鹿ばっかり。何もわからないなら目の前のことだけやってな。",
126,"いい加減、気持ち悪い
なにやら教祖様のように崇め奉る親衛隊の様な
方々もおられる様ですが
さすがにこれはおかしいと思えよ

対戦相手にも迷惑だろ、絶対うっとおしいぞ
大体あの""出ない出ない""、""出る出る""は何？
なんかこういう行動をするのも、それに対して
称賛の声を挙げるのも""ワタシカッケー""みたいに
なってるけど、お互いに抗議の意志だのなんだの
したいなら""時と場所""を、この場合は""手段""も
合わせてわきまえろ

""欧米人""が大好きな""TPO""とか言うやつだろ？",
127,親の間違った教育の影響なのか？黒人として生きていった方がいい。悪いけど理解も共感も出来ないね。何故なら、やってる事が白人と同じよ。何やっても許されるとでも？愚かだね。日本の国籍は返上してくれ。,
128,"『ただ楽しませればよい』
なんて思ってるひとは少数だと思いますけどね。

ただなんでもかんでも引っ張り出すのは
なんかもうウンザリっていうか…。

言い出したらきりがないでしょ？
黒人だって、アジア人とか差別してる人
いるよね？

最近のこの人の行動みてると
なんか逆に対立を煽ってるみたいに見えて
もうお腹いっぱいです。",
129,"人権問題に取り組んでますアピールの為にウイリアムズ姉妹を使い、彼女らが衰えてきたところでハーフ、アジア、黒人の三拍子揃った彼女を使う
なんだかね",
130,"なおみ、今回の犠牲者は黒人だったが、これがもし日本人なら同じような抗議行動してくれる？

哀悼の意を声明で出すだけだと同じ日本人として悲しくなるからね。",
131,"コートでは だれでも一人 一人きり
私の愛も 私の苦しみも
だれも わかってくれない
きらめく風が走る 太陽が燃える",
132,名前が日本人なだけで考え方や行動は外国人。コーチの首切りの件以降この子に関してはそういう印象しかない。,
133,歌手がステージでプロテストソング歌うのと一緒で彼女はテニスが自己表現の場だから何ら問題ないと思う嫌なら見るきゃ良い。差別された事のない日本人がとやかく言う事じゃない。,
134,"人種差別はあかんやろうけど、なんか最近は黒人優遇すぎるなと思う。
黄色人種差別のほうがひどくなってるのに、そちらはスルーだし。",
135,"これ以上この抗議活動するのであれば
大阪なおみという日本名を
改名して欲しい。
日本人が・・・
と思われて過激に反応されてもいい迷惑だし
そもそもメンタルも含めて
やはり黒人だから。",
136,"対戦相手の人種はお構い無し。
このぐらい他人の事を気遣わないメンタルは、テニスには必要ということ。",
137,相変わらず自分たちは白人側だと思ってる人ばかり。傍観者だから彼女を非難するコメントが書けるんですよ。中国も韓国も日本もすべてアジア人で、黒人側の扱いですよ。,
138,"勝手にやればいいが個人的に気持ち悪いし黒人だからってなんでも許されると思ったら大間違い。
最初は黒人差別反対と思ってたが、もはや最近の黒人は差別を逆手に取った暴徒。何の同情もないわ。",
139,"黒人の命も大切だ・・・も、ではなく
は、が正しい意味ではないのか？",
140,人種に囚われないのであれば、日本人だろうが白人だろうがＢＬＭと書かれたものを身に着けても何の問題もない。,
141,"テニスのプレーに集中して下さい。その後自分がやりたい事をやってちょうだい。
負けた理由に差別されているからと、決して言わないように！",
142,この子が人気急増したのはセリーナのようなワガママ女の対極だったからなのに、今じゃセリーナよりたち悪い。,
143,"BLACK LIVES MATTERの犠牲者は、アイスというドラッグでハイになってたらしいね

今回の人も薬物と暴力",
144,へんな勢力に利用されないことが問題。ぐれた嬢のように,
145,黒人を初めとした外国人の、同調圧力は凄まじい,
146,その黒人も平気でアジア人差別とかしてる事を忘れてはいけない,
147,"黒人のためかもしれないけど一番重要なのは自身のファンやテニスファンじゃないの？
ちょっとガッカリだな。",
148,自分は黒人じゃないので応援するのは申し訳ない。黄色や白に応援されても嬉しくないだろう。,
149,この人、日本人嫌いですからね。私は黒人だといって活動するのは問題ありません。この人を日本人だと言って応援してる人は考えたほうがいいですよ。,
150,"BLMに襲われたお店の黒人店主や、黒人に殺された白人警官のことはどう思ってるんだろうか？

どうも思ってないだろうな。",
151,"あれ？この間の車からナイフ取り出そうとして撃たれた黒人の名前じゃないんだね
なんで？",
152,犯罪を犯した黒人を取り締まっただけで、よくもまあここまで騒げるものだね。,
153,"コイツのせいで
「黒人って何か嫌なことがあったら仕事をサボるんだ…」
というイメージが強くなりました。",
154,自分的には「やり過ぎかな」と思います。,
155,彼氏が活動家だからね,
156,殺された白人に関してコメントをしていれば見方も変わったけどやっぱりだめだこいつ,
157,"黒人が黒人の為にってのは微妙に違うな
大坂自体は黄色人種と黒人のハーフだし",
158,黒人選手全員がこんなことしたらどーなる？白人勝ったら悪者みてーじゃん。フェアでない,
159,"誰か止めてやれ！
周りもよっぽど悪いぞ！",
160,正直、興ざめするわ。,
161,楽しそうでなによりです,
162,"・・how does yr mom

feel...？",
163,"＞「アスリートが政治的な活動に加わる必要があるのか？」

必要。
アスリートはアンタのペットではなく、
主権者の１人だから。",
164,今度はマスクでなく、黒人の名前の入れ墨を入れたらいい！,
165,"こないだ黒人を警察官が背後から撃ったということで、試合をボイコットしましたが、この黒人は車に乗り込んでナイフを取り出したため、警察官は撃ったという事実が明らかになってますよね。しかも暴行・強姦で前科あり、現在も裁判中です。

差別問題に抗議の意を示すのはいいと思うのですが、きちんと事実を調べてから抗議しているのでしょうか。なんか、世論がこうだから自分も飛びついている、という感があるためなんか薄っぺらく見えてしまうのです。",
